id,link,title,date,summary,organization,sentiment,initiative,language,themes
471,https://riskspan.com/pre-issue-intex-cdi-files-loan-level-data/,"Enriching Pre-Issue Intex CDI Files with [Actual, Good] Loan-Level Data - RiskSpan",2024-01-01,"The article discusses the challenges investors face when working with pre-issue Intex CDI files in RMBS deals, which often lack important loan-level details necessary for running complex models. While the loan-level data exists separately in a ""loan tape,"" investors must manually integrate this information into the CDI file, leading to a time-consuming and error-prone process. RiskSpan's Edge Platform offers a solution by automatically extracting and connecting the required loan-level data to the CDI file, streamlining the pre-trade analytics process into a few simple clicks. This innovation demonstrates a more efficient and accurate way to evaluate deal structures and expected loan performance, highlighting the potential benefits of leveraging technology to enhance ABS Capacity Development Initiative (ABS CDI) efforts and related initiatives in promoting transparency and efficiency in the financial industry.",RISKSPAN,Neutral,ABS Initiative,English,"Loan-level data, RMBS dealers, CDI files, RiskSpan's Edge Platform, pre-trade analytics process"
470,https://www.superturbodiesel.com/std/showthread.php?tid=6451,cdi conversion,None,"The content discusses a conversion project involving an OM611 engine from a C220CDI into a W126 vehicle, addressing potential issues with the CANBUS system. The focus is on connecting ABS sensors from the W202 to the W126 rear diff to provide a speed signal to the OM611 ECU. Positive messages include potential success in the conversion project and the importance of ensuring similar pulse counts per revolution in both vehicles. The initiative showcases innovative solutions and problem-solving skills in adapting different technologies for sustainable development.",SUPERTURBODIESEL,Neutral,ABS Initiative,English,"cdi conversion, engine transplant, canbus issues, ABS sensors, electronic wiring"
469,https://www.youtube.com/watch?v=Lm-Q0W0C7bc,- YouTube,2024-03-06,"The content provided does not mention any specific information related to the ABS Capacity Development Initiative (ABS CDI) or any related initiatives, projects, events, or activities focusing on sustainable development or conservation. There are no references to specific countries or regions, and no positive messages or implications about the ABS initiative or its goals are included in the content.",YOUTUBE,Neutral,ABS Initiative,English,"Technology, Online video streaming, Digital advertising, Copyright protection, Privacy policy"
468,https://www.aliexpress.com/i/1005005288936584.html,Gycl|gy6 125cc 150cc Cdi Ignition System - AliExpress,None,,ALIEXPRESS,Neutral,ABS Initiative,English,"Content Analysis, Documentation"
467,https://www.bnb4moto.com/en/yamaha/1104-cdi-ecu-yamaha-xj-6-n-abs-2009.html?srsltid=AfmBOopqRHI2tyZim3CGc-w8j5xRw1Kt3HSDCF0iOtEG-WCO_9W4N-bf,"CDI ECU Yamaha XJ 6 N ABS 2009, 36B8591A0000",2009-01-01,"The content provided discusses the CDI ECU Yamaha XJ 6 N ABS 2009 part, specifically mentioning the part number 36B8591A0000. The product is used and removed from a Yamaha XJ 6 N ABS from the year 2009. The content also includes information on cookies, privacy policy, and collecting personal information. The CDI ECU fits various models of Yamaha bikes and is available for purchase. The positive message conveyed is the guarantee related to conformity and the commitment to maintaining trust and confidence with website visitors. The content mentions countries such as Romania and specific models like the Yamaha TDM 850 4TX 1997.",BNB4MOTO,Neutral,ABS Initiative,English,"CDI ECU, Yamaha XJ 6 N ABS 2009, Part number, Used products, Privacy Policy"
466,http://www.peachparts.com/shopforum/diesel-discussion/413878-w211-e320-cdi-esp-abs-fault-2.html,W211 E320 CDI ESP and ABS fault - Page 2 - PeachParts Mercedes-Benz Forum,2001-01-01,"The content discusses a technical issue related to ABS and ESP faults in a Mercedes-Benz W211 E320 CDI, prompting users to clean the sensor and mounting surfaces. Despite attempts to resolve the fault with cleaning and grease application, the issue persists. Users seek advice on proper cleaning methods and potential causes of the fault. The discussion includes references to the ABS Capacity Development Initiative (ABS CDI) and related initiatives, emphasizing the importance of proper maintenance and troubleshooting in vehicle systems. The positive message conveyed is the collaborative effort of users to address technical challenges and support each other in resolving issues related to ABS and ESP faults in Mercedes-Benz vehicles.",PEACHPARTS,Neutral,ABS Initiative,English,"ESP and ABS fault, cleaning sensors, brake clean, dielectric grease, sensor hole"
465,https://gpa-moto.fr/en/burgman-abs-400/1001300423-cdi-box-suzuki-burgman-abs-400-u3-3896x.html,Cdi Box SUZUKI BURGMAN ABS 400 - U3-3896X - GPA MOTO,2022-01-01,"The content discusses the Cdi Box for a SUZUKI BURGMAN ABS 400, providing details such as the model, year, mileage, and warranty information. The website offers related products for this model, such as fuel pumps and master cylinders. The positive messages include free and fast delivery, quality checks, and a 2-year warranty on parts. The website also emphasizes secure payment options and customer support. The focus is on providing quality parts for motorcycles and cars, contributing to sustainable practices with recycling and saving tons of materials. The ABS Capacity Development Initiative (ABS CDI) or related initiatives are not explicitly mentioned in the content.",GPA-MOTO,Neutral,ABS Initiative,English,"Motorcycle parts, Warranty, Delivery, Customer support, Recycling"
464,https://smartmaniacs.co.uk/forum/the-cars/fortwo-451-sept-2007-present/879532-esp-and-abs-lights-intermitent-451-cdi,"ESP and ABS lights intermitent 451 CDI - 
		
		smartManiacs",2017-01-01,"The content discusses issues with ESP and ABS lights in a smart car model 451 CDI, despite changing the ABS sensor and reluctor ring. The lights come on intermittently, accompanied by a high-pitched whining noise and beeping when braking. Diagnostic tests suggest potential issues with the ABS ECU/pump. The car recently underwent an MOT and required new front tires. The discussion involves troubleshooting steps and potential solutions for the ABS and ESP issues. The content does not explicitly mention the ABS Capacity Development Initiative or related initiatives, specific projects, events, or activities related to sustainable development or conservation, countries or regions specified, or positive messages or implications about the ABS initiative or its goals.",SMARTMANIACS,Neutral,ABS Initiative,English,"Car maintenance, ABS sensor error, Reluctor rings, Brake issues, Diagnostic testing"
463,https://onlinecarparts.co.za/abs-sensors/61862-mercedes-benz-ml-w164-ml350-cdi-om642940-24v-10-12-abs-sensor-2-pin.html?srsltid=AfmBOopGSDiIAV8uoXieayu_ap_YzjWBNZpBGft3Q0rjn7qaNw360B-u,Mercedes Benz ML W164 ML350 CDI OM642.940 24V 10-12 ABS Sensor 2 Pin,None,"The content discusses ABS sensors for various vehicle models, including the Mercedes Benz ML W164 ML350 CDI. Specific projects and events related to ABS sensors for BMW, Renault, and other brands are mentioned. The focus areas include ABS sensor specifications and compatibility with different vehicle models. The content does not specify any countries or regions. Overall, the content provides information on ABS sensors for different vehicles, highlighting the availability and compatibility of ABS sensors for specific models.",ONLINECARPARTS,Neutral,ABS Initiative,English,"Vehicle Parts, Mercedes Benz, ABS Sensor, Brand Identification, Delivery Policy"
462,https://www.amazon.ca/Outboard-6H2%E2%80%9185540%E2%80%9110%E2%80%9100-Assembly-Replacement-Stroke/dp/B09YXPTYR3,"Outboard CDI Unit, 6H2‑85540‑10‑00 ABS CDI Coil Unit Assembly Replacement for 2 Stroke Power Outboard Motor, Ignition Coils - Amazon Canada",2023-01-01,"The content refers to an Outboard CDI Unit replacement part for a 2 Stroke Power Outboard Motor, available on Amazon Canada. The item is sold by Terisass and is eligible for return or refund within 30 days. The product is described as an ABS CDI Coil Unit Assembly, emphasizing its application for motor vehicles. The focus is on automotive and motorcycle accessories, specifically ignition coils. The positive implication is the availability of a replacement part for motor maintenance, supporting sustainable development and conservation efforts in the automotive industry.",AMAZON,Neutral,ABS Initiative,English,"Automotive, Motorcycle Accessories & Parts, Ignition, Ignition Coils, Outboard Motor"
461,https://www.justanswer.com/mercedes/miynr-just-bought-w211-e270-cdi-2003-bought.html,Mercedes W211 E270 CDI ABS/ESP Faults - JustAnswer,None,,JUSTANSWER,Neutral,ABS Initiative,English,"Content Analysis, Documentation"
460,https://www.scooterwest.com/vespa-primavera-sprint-150-iget-abs-regulator-cdi-ht-coil.html?srsltid=AfmBOoqx5xQjwxFskzV0cdH1bfYlPWHMjantMOWwelveeglsDImZaB4w,"ScooterWest.com -  Vespa Primavera/Sprint 150 iGET ABS  Regulator, CDI & HT Coil",None,"The content provided on ScooterWest.com focuses on the Vespa Primavera/Sprint 150 iGET ABS Regulator, CDI & HT Coil. Specific products and parts related to this model are listed, along with their prices and availability. The website offers a range of items for Vespa scooters, including screws, bolts, sensors, and wiring harness clamps. While the content does not directly reference the ABS Capacity Development Initiative (ABS CDI) or related initiatives, it does highlight the importance of maintaining and repairing scooters to ensure their optimal performance. The positive message implied is the commitment to providing quality parts and accessories for Vespa scooters, contributing to their longevity and sustainability. The focus is on offering a comprehensive selection of products to support scooter owners in their maintenance and repair needs, ultimately promoting the continued use and enjoyment of Vespa scooters.",SCOOTERWEST,Neutral,ABS Initiative,English,"Vespa Primavera/Sprint 150 iGET ABS, Regulator, CDI, HT Coil, Voltage Regulator, Transmission Cover Screw, Turn Signal Flasher, Sparkplug Wire"
459,https://forums.mbclub.co.uk/threads/abs-esp-fault-codes-slk-250-cdi.243995/,"ABS ESP fault codes SLK 250 CDI | Wheels, Tyres, Brakes & Suspension | MBClub UK - Bringing together Mercedes Enthusiasts",2018-01-01,"The discussion on the MBClub UK forum revolves around ABS and ESP fault codes in a Mercedes SLK 250 CDI. The user, JamesFoxbat, is seeking advice on error codes C111100, C111200, C327100, and C326600, which are not found in the scanner's database or online. Suggestions point towards a potential issue with the wheel speed sensors, a common problem that can be resolved by replacing the sensors, estimated to cost around £50 to £70 each. The discussion highlights the importance of identifying the specific wheel affected and the relatively straightforward nature of the replacement process. The positive takeaway from the conversation is the accessibility of solutions for ABS-related issues in Mercedes vehicles, emphasizing the potential for cost-effective repairs and maintenance.",FORUMS,Neutral,ABS Initiative,English,"ABS ESP fault codes, Mercedes SLK 250 CDI, Wheel speed sensors, iCarsoft i980 scanner, Fault clearing, Replacement parts."
458,https://sprinter-source.com/forums/index.php?threads/121014/,"2005 316 cdi, 2.7l - ABS, ESP & traction warning lights on LHM | Sprinter-Source.com",2023-01-01,"The post discusses a 2005 Mercedes Sprinter with ABS, ESP, and traction warning lights on, causing it to go into LHM. The owner has tried various solutions, including replacing relays and considering replacing the ABS control module, which is no longer in production. The post highlights the challenges of finding replacement parts for older vehicles and the frustration of dealing with obsolete components. Despite the difficulties, the owner is determined to find a solution and prevent scrapping the motorhome. The post reflects the importance of maintaining and troubleshooting older vehicles, showcasing the dedication to preserving and utilizing existing resources.",SPRINTER-SOURCE,Neutral,ABS Initiative,English,"Vehicle diagnostics, ABS control module, Auto electrician, Mercedes Sprinter, LHM (Limp Home Mode)"
457,https://forums.mercedesclub.org.uk/index.php?threads/220-cdi-bas-abs-eps-and-epc.102186/,220 cdi BAS ABS EPS AND EPC | Mercedes-Benz Owners' Forums,2012-01-01,"The discussion on the Mercedes-Benz Owners' Forums revolves around issues with the BAS, ABS, EPS, and EPC systems in a 220 CDI model. Users seek advice on possible causes such as a faulty brake switch or dampness in the fuse box. Suggestions include checking the brake lamp switch and using a diagnostic device like STAR to reset warnings. The focus is on resolving these technical issues to ensure the proper functioning of the vehicle. The positive implication is that by addressing these issues, the ABS Capacity Development Initiative (ABS CDI) and similar initiatives can contribute to sustainable development and conservation efforts in the automotive industry. The exchange of knowledge and solutions among users reflects a collaborative approach to problem-solving, aligning with the goals of ABS initiatives to promote capacity building and innovation in the sector.",FORUMS,Neutral,ABS Initiative,English,"ABS, ESP, EPC, Brake switch, Diagnostic."
456,https://forums.mercedesclub.org.uk/index.php?threads/2012-s204-c220-cdi-abs-esp-run-flat-fault.187251/,"2012 S204 C220 CDI - ABS, ESP, Run Flat Fault. | Mercedes-Benz Owners' Forums",2021-01-01,"The discussion on the Mercedes-Benz Owners' Forums revolves around a technical issue with a 2012 S204 C220 CDI, involving ABS, ESP, and a run-flat sensor fault. The user seeks advice on diagnosing and resolving the problem, which has recurred despite replacing ABS sensors. The fault codes indicate an implausible RPM sensor issue on both front axles. Suggestions include checking the reluctor rings for any abnormalities. The conversation highlights the community's willingness to offer assistance and share knowledge to troubleshoot and resolve technical issues, showcasing a collaborative and supportive environment for addressing automotive challenges.",FORUMS,Neutral,ABS Initiative,English,"ABS sensor replacement, Diagnostic report analysis, Reluctor rings inspection, Braking system maintenance, Fault code interpretation"
455,https://motoparts22.com/en/17469-suzuki-dl-650-v-strom-abs-cdi-unit-27ga1-mgt114-27g-a1-mgt-114,MOTOPARTS 22 -  SUZUKI DL 650 V STROM  ABS CDI UNIT  27GA1 MGT114  27G A1  MGT 114,None,"The content mentions the ABS Capacity Development Initiative (ABS CDI) in relation to a Suzuki DL 650 V STROM ABS CDI unit. The focus is on electrical/ignition components, highlighting the importance of understanding the terms of use before purchasing. The specific project or activity involves the sale of this unit, with a discount offered. The region specified for shipping includes various countries worldwide. Despite the technical nature of the content, the positive implication is the availability of original parts for Suzuki motorcycles, supporting the goals of the ABS initiative in promoting sustainable development and conservation through the maintenance and repair of vehicles.",MOTOPARTS22,Neutral,ABS Initiative,English,"Motorcycle parts, Electrical/Ignition, Suzuki DL 650 V Strom, CDI unit, Stock of Parts & Accessories"
454,https://www.montclairmotorcycles.co.za/products/honda-cbr600rr-abs-control-unit?srsltid=AfmBOoqsO8nXajRNiwB74uN-DjuuySLO9x0Ka3SnDBWQm-e_vC3Rk1Fw,"Honda CBR600RR CBR600 ABS CDI / ECU
 – Montclair Motorcycles Online",None,"The content mentions the Honda CBR600RR CBR600 ABS CDI/ECU available at Montclair Motorcycles Online, focusing on a specific part (Part no. 38600-MFJ-A52) for year models 2007-2012. The item is used and includes delivery. While the content does not explicitly reference the ABS Capacity Development Initiative (ABS CDI) or related initiatives, it highlights the importance of ABS control units in motorcycle safety. The positive implication is the availability of this part for purchase, potentially contributing to the maintenance and safety of motorcycles in various countries or regions.",MONTCLAIRMOTORCYCLES,Neutral,ABS Initiative,English,"Honda CBR600RR, CBR600 ABS, CDI, ECU, Motorcycles"
453,https://shopee.com.my/NMAX-VTC-CDI-Unit-With-ABS-No-ABS-STD-Standard-Engine-Control-ECU-C.D.I.-E.C.U.-Unit-Yamaha-NMAX155-N-MAX-NMAX-155-i.447528402.25369453996,NMAX VTC CDI Unit - With ABS / No ABS | Shopee Malaysia,None,,SHOPEE,Neutral,ABS Initiative,English,"Content Analysis, Documentation"
452,https://www.nomura.com/india/careers/,"Careers, Nomura India",2024-01-01,"The content discusses career opportunities at Nomura, a global investment banking firm with a strong commitment to delivering unique value to clients. The Nomura India office in Mumbai offers high-value services in Capital Markets and Investment Banking. The company's global network spans 30 countries and three main divisions: Global Markets, Investment Banking, and Corporate Infrastructure. Nomura's Group CEO emphasizes the importance of supporting Japan's future growth through a new social framework and revised financial system. The company aims to facilitate the flow of funds in Japan's economy to promote sustainable growth. Nomura's focus on connecting markets East & West highlights the importance of Asian countries financing infrastructure projects for economic development. This content reflects Nomura's dedication to innovation, diversity, and corporate citizenship, making it an appealing choice for aspiring entrepreneurs and leaders looking to shape the future.",NOMURA,Neutral,ABS Initiative,English,"Careers, Global Investment Banking, Entrepreneurship, Leadership, Corporate Citizenship"
451,https://www.3gpp.org/,3GPP – The Mobile Broadband Standard,2025-03-11,"The content discusses the 3GPP (3rd Generation Partnership Project) and its role in developing mobile broadband standards. It mentions the Workshop on 6G in Incheon, Korea, focusing on the future of mobile technology. The 3GPP unites telecommunications standard development organizations to produce reports and specifications. The positive message is that the 3GPP is shaping the future of mobile communication through collaboration and innovation.",3GPP,Neutral,ABS Initiative,English,"Mobile broadband standards, 6G technology, technical specifications, organizational partnerships, network evolution."
450,https://www.samhsa.gov/technical-assistance/brss-tacs/peer-support-workers,Peer Support Workers for those in Recovery - SAMHSA,None,,SAMHSA,Neutral,ABS Initiative,English,"Content Analysis, Documentation"
449,https://www.bruegel.org/policy-brief/how-deepseek-has-changed-artificial-intelligence-and-what-it-means-europe,How DeepSeek has changed artificial intelligence and what it means for Europe,2025-01-30,"The content discusses how the DeepSeek AI model has changed the landscape of artificial intelligence, particularly in Europe. The use of chain-of-thought (CoT) training data has shifted AI training from costly pre-training to cheaper fine-tuning, making smaller AI models like DeepSeek more efficient. This shift in cost structure presents an opportunity for European companies to catch up in building AI applications. However, it also raises challenges such as increased price competition and the need to protect investments against free-riding. Overall, the emergence of DeepSeek and similar models signifies a shift towards more accessible AI technology, with implications for innovation and competition in the field.",BRUEGEL,Neutral,ABS Initiative,English,"artificial intelligence, DeepSeek, model development, European Union, knowledge extraction"
448,https://www.walchandpeoplefirst.com/,Customised Training & Development Solutions | Walchand Plus,2022-01-01,"Walchand Plus, an initiative of Walchand PeopleFirst Limited, in partnership with Dale Carnegie Training, offers customised training and development solutions. The initiative focuses on providing essential and behavioral skills for the corporate sector, HR consultancy, skilling for employability, entrepreneurship, and empowerment. Services include learning and development programs, HR consulting, education and skilling initiatives, CSR projects, and Dale Carnegie programs in leadership, team engagement, sales, communication, and more. The initiative aims to empower individuals and organizations to thrive in the modern world through capacity building and skill development.",WALCHANDPEOPLEFIRST,Neutral,ABS Initiative,English,"Customised Training, Development Solutions, Empowerment, HR Consulting, Education & Skilling, CSR & Social Projects, Dale Carnegie Programs, Capacity Building, Sustainability, Behavioral Skills"
447,https://cowsmo.com/news/usda-announces-23-million-in-grant-funding-available-to-support-the-u-s-dairy-industry/,USDA Announces $23 Million in Grant Funding Available to Support the U.S. Dairy Industry - Cowsmo,2023-01-01,"The U.S. Department of Agriculture (USDA) has announced $23 million in grant funding through the Dairy Business Innovation Initiatives to support the U.S. dairy industry. This initiative focuses on processing capacity expansion, on-farm improvements, and technical assistance services for dairy farmers and businesses. The program aims to provide support for business plan development, marketing, branding, and innovative production and processing techniques to develop value-added products. The funding will be awarded to initiatives in California, Tennessee, Vermont, and Wisconsin, with a focus on supporting small and mid-sized dairy operations. The USDA encourages applications that benefit smaller farms, new and beginning farmers, underserved producers, veterans, minorities, and underserved communities. The initiative promotes climate-resilient landscapes and rural economic systems, with a focus on reducing greenhouse gas emissions and adapting to climate change. This initiative highlights USDA's efforts to build capacity and support sustainable development in the dairy industry.",COWSMO,Neutral,ABS Initiative,English,"Grant Funding, Dairy Industry Support, Technical Assistance, Business Plan Development, Climate Resilience."
446,https://www.un.org/en/about-us/un-charter/full-text,United Nations Charter (full text) | United Nations,1942-01-01,"The content provided is the full text of the United Nations Charter, which outlines the purposes and principles of the United Nations. The Charter emphasizes the importance of maintaining international peace and security, promoting friendly relations among nations, achieving international cooperation in solving economic, social, cultural, and humanitarian issues, and fostering respect for human rights and fundamental freedoms. The Charter also establishes the United Nations as a center for harmonizing the actions of nations towards these common goals. While the content does not specifically mention the ABS Capacity Development Initiative (ABS CDI) or related initiatives, it aligns with the goals of sustainable development, conservation, and promoting social progress mentioned in the ABS CDI. The Charter's focus on peace, cooperation, and human rights sends a positive message about the importance of international collaboration and working towards common goals for the betterment of all peoples.",UN,Neutral,ABS Initiative,English,"International peace and security, Prevention of war, Human rights, Social progress, Economic cooperation"
445,https://www.closingthegap.gov.au/national-agreement,National Agreement on Closing the Gap | Closing the Gap,2022-01-01,"The National Agreement on Closing the Gap aims to address inequality experienced by Aboriginal and Torres Strait Islander people in Australia through genuine partnership between governments and Indigenous organizations. The Coalition of Aboriginal and Torres Strait Islander Peak Organizations played a central role in developing the agreement, with input from extensive engagements with Indigenous communities. The Australian Institute of Health and Welfare and the Australian Bureau of Statistics supported the development of the agreement by providing technical advice and data. The agreement emphasizes the need for flexibility and collaboration, with a focus on four Priority Reforms to strengthen partnerships, support community-controlled sectors, transform government organizations, and improve data access. This initiative highlights a positive step towards achieving equality and improving outcomes for Indigenous Australians, with a strong emphasis on collaboration and inclusivity.",CLOSINGTHEGAP,Neutral,ABS Initiative,English,"Closing the Gap, Indigenous rights, Partnership, Data sharing, Government reform"
444,https://www.ohchr.org/en/instruments-mechanisms/instruments/convention-rights-persons-disabilities,Convention on the Rights of Persons with Disabilities | OHCHR,None,,OHCHR,Neutral,ABS Initiative,English,"Content Analysis, Documentation"
