id,link,title,date,summary,organization,sentiment,initiative,language,themes
718,https://www.abs.go.kr/kabsch/program/newsletter/view.do?cid=98&nsIdx=2664,ABSCH 유전자원정보관리센터,None,"The content discusses the key focus areas for the upcoming CBD COP16, including the establishment of the Digital Sequence Information (DSI) regime, National Biodiversity Strategies and Action Plans (NBSAPs), and biodiversity financing. The ABS Capacity Development Initiative (ABS CDI) and Meridian Institute are mentioned as hosting various meetings to address DSI issues before COP16. The positive message conveyed includes efforts to secure biodiversity funding, develop NBSAPs, and engage in discussions on DSI, reflecting a commitment to conservation and sustainable development goals. Countries such as Colombia and Norway are involved in these initiatives, highlighting global cooperation towards achieving biodiversity conservation objectives.",ABS,Neutral,ABS Initiative,English,"Access to genetic resources, Benefit-sharing, National biodiversity strategies and action plans (NBSAPs), Digital sequence information (DSI), Plastic pollution treaty"
717,https://ausschreibungen.giz.de/Satellite/public/company/project/CXR2YYRYY6Z/de/processdata,Vergabemarktplatz GIZ,None,,GIZ,Neutral,ABS Initiative,English,"Content Analysis, Documentation"
716,https://s3.amazonaws.com/absch.documents.abs/records/absch-vlr-scbd-240908-2-en.pdf,[PDF] watch?v=xPgZdD5B5tY∈dex=2&list ...,None,"This PDF document provides detailed information about the ABS Initiative, including its objectives, key activities, and impact on biodiversity conservation. It highlights the importance of Access and Benefit Sharing (ABS) agreements in promoting sustainable development and equitable sharing of benefits derived from genetic resources. The document also discusses the role of the ABS Clearing-House in facilitating access to information and promoting compliance with ABS regulations.

Publisher: AMAZONAWS
Source: https://s3.amazonaws.com/absch.documents.abs/records/absch-vlr-scbd-240908-2-en.pdf",S3,Neutral,ABS Initiative,English,"Biodiversity Conservation, Sustainable Development, Climate Change, Ecosystem Services, Marine Conservation"
715,https://www.academia.edu/49241818/BIO_PROSPECTING_IN_THE_CARIBBEAN_REGION_Caribbean_ABS_Traditional_Knowledge_Stocktaking_Traditional_Knowledge_in_the_Caribbean_Region,(PDF) BIO-PROSPECTING IN THE CARIBBEAN REGION Caribbean ABS Traditional Knowledge Stocktaking Traditional Knowledge in the Caribbean Region,2019-01-01,"The content discusses bio-prospecting in the Caribbean region, focusing on traditional knowledge and the ABS Capacity Development Initiative (ABS CDI). The document highlights projects related to sustainable development and conservation, specifically in the Caribbean region. Positive implications are seen in the efforts to advance the Nagoya Protocol and strengthen regional instruments for biodiversity conservation, reflecting a commitment to protecting the region's natural resources.",ACADEMIA,Neutral,ABS Initiative,English,"Biodiversity Conservation, Traditional Knowledge, Genetic Resources, Geographical Entities, Regional Legal Framework"
714,https://mg.chm-cbd.net/events/table-ronde-sur-le-centella-et-les-mesures-transitoires-d-acces-aux-ressources,Table ronde sur le Centella et les mesures transitoires d'Accès aux Ressources génétiques et de partage des avantages découlant de leurs utilisations | Convention sur la Diversité Biologique,2015-12-11,"A roundtable discussion was held on the Centella and transitional measures for Access to Genetic Resources and Benefit Sharing (ABS) under the Nagoya Protocol. The ABS Capacity Development Initiative (ABS CDI) aims to create fair exchange conditions and legal security for nature's economic valuation. The meeting focused on defining the legal and regulatory framework for ABS in Madagascar. This initiative highlights the importance of sustainable development and conservation efforts in the region, emphasizing the positive impact of ABS goals on biodiversity preservation and equitable resource sharing.",MG,Neutral,ABS Initiative,English,"Genetic Resources, Access and Benefit Sharing, Legal Framework, Market Approach, Transitional Measures"
713,https://hanketori.fi/tenders/auftragsanderung-1-81305584-provision-of-technical-expertise-advisory-and-training-services-for-the-project/,"Auftragsänderung 1:  81305584-Provision of technical expertise, advisory and training services for the project – Hanketori",2025-03-24,"The ABS Capacity Development Initiative (ABS CDI) is a multi-donor initiative aimed at improving cooperation for the fair sharing of benefits related to biodiversity conservation and sustainable use. Launched in 2006, it supports a globally harmonized ABS system with the Nagoya Protocol and CBD goals at its core. Supported by governments like Switzerland, Norway, and the Netherlands, as well as international organizations, the ABS Initiative collaborates with the SCBD and partners like the African Union Commission and UNCTAD to enhance capacity development in African countries such as Kenya, Côte d'Ivoire, and South Africa. Emphasizing participatory processes, good governance, and gender equality, the ABS Initiative contributes to poverty reduction, food security, technology transfer, social development, and biodiversity conservation. Through its activities, it aims to fulfill the vision of harmonious coexistence with nature through benefit-sharing.",HANKETORI,Neutral,ABS Initiative,English,"Biodiversity Conservation, Benefit-sharing, Capacity Building, Regional Integration, Gender Equality"
712,https://www.abs-biotrade.info/news-1/abs-capacity-development-for-transformative-change/,ABS Biotrade: ABS capacity development for transformative change,None,"The ABS Capacity Development Initiative (ABS CDI) held a side event at the 4th Meeting of the Subsidiary Body on Implementation of the CBD, focusing on transformative change in ABS implementation to support GBF Goal C & Target 13. The event, hosted by the German Federal Ministry for Economic Development and Cooperation (BMZ) with support from Norway, The Netherlands, and the UK, aimed to discuss new strategies for capacity development, including promoting multi-stakeholder partnerships, integrating research and BioTrade into national policies, and involving indigenous peoples and local communities in benefit-sharing agreements. Specific projects and activities mentioned included IP&LCs trainings, fostering partnerships, and establishing benefit-sharing mechanisms for digital sequence information. The positive implications of the ABS initiative were highlighted through the promotion of long-term partnerships, sustainable biodiversity-based value chains, and fair benefit-sharing, emphasizing a shift towards incentivizing the use of genetic resources.",ABS-BIOTRADE,Neutral,ABS Initiative,English,"Biodiversity conservation, Benefit-sharing mechanisms, Multi-stakeholder partnerships, Sustainable use of biological resources, Indigenous peoples' participation"
711,https://unctad.org/system/files/official-document/ditc-ted-05052020-BioTradeSSC-Marula-report.pdf,[PDF] Report on the first regional workshop on a Marula sector ... - UNCTAD,None,"The PDF document from UNCTAD provides a comprehensive report on the first regional workshop on the Marula sector, focusing on the implementation of the Access and Benefit Sharing (ABS) Initiative. The report outlines key discussions, challenges, and recommendations for promoting sustainable trade and development within the Marula sector through the ABS framework. It highlights the importance of collaboration between stakeholders to ensure equitable sharing of benefits derived from Marula resources.

Publisher: UNCTAD
Source: https://unctad.org/system/files/official-document/ditc-ted-05052020-BioTradeSSC-Marula-report.pdf",UNCTAD,Neutral,ABS Initiative,English,"Marula sector, Sustainable development, Trade, Regional workshop, BioTrade"
710,https://www.abs-biotrade.info/partner-countries/pacific/general-information/,ABS Biotrade: General Information,None,"The ABS Capacity Development Initiative (ABS CDI) has been active in the Pacific region since 2011, focusing on the rich biodiversity and traditional knowledge found in Pacific Island Countries and Territories (PICTs). The region is home to diverse ecosystems, including the western Coral Triangle, and is characterized by high endemism and biological diversity. The ABS CDI has highlighted successful benefit-sharing arrangements, such as the CIMTECH agreement, which involves traditional medicine for bone and wound healing. Partners like the University of New South Wales (UNSW) and the Secretariat of the CBD are working on projects to protect biodiversity-related indigenous knowledge, showcasing positive outcomes for local communities and sustainable development in the Pacific.",ABS-BIOTRADE,Neutral,ABS Initiative,English,"Biodiversity Conservation, Traditional Knowledge, Genetic Resources, Benefit-sharing Arrangements, Marine Biotechnology"
709,https://www.darwininitiative.org.uk/documents/DAR22017/23405/22-017%20App%20St2%20-%20edited.pdf,[PDF] Submit by x January - Darwin Initiative,None,"The PDF document outlines the submission deadline for the Darwin Initiative, specifically focusing on the Access and Benefit Sharing (ABS) Initiative. It provides detailed information on how to submit proposals by the specified deadline of x January. The document emphasizes the importance of complying with ABS regulations and guidelines in order to participate in the Darwin Initiative.

Publisher: DARWININITIATIVE
Source: https://www.darwininitiative.org.uk/documents/DAR22017/23405/22-017%20App%20St2%20-%20edited.pdf",DARWININITIATIVE,Neutral,ABS Initiative,English,"Biodiversity Conservation, Sustainable Development, Community Participation, Ecosystem Management, Conservation Funding"
708,https://de.linkedin.com/in/andreas-gettkant-66454b14,"Andreas Gettkant - GIZ ConoSur (Argentina, Chile, Perú) - LinkedIn",None,,DE,Neutral,ABS Initiative,English,"Content Analysis, Documentation"
707,https://bertjan-bouman.squarespace.com/s/Annual-report-UEBT-2016.pdf,[PDF] Annual Report - UEBT,None,"The PDF document is the Annual Report for the Union for Ethical BioTrade (UEBT) in 2016. It provides detailed information about the UEBT's activities and progress in promoting ethical sourcing and the Access and Benefit Sharing (ABS) Initiative. The report highlights the organization's achievements and impact in promoting sustainable sourcing practices in the beauty and personal care industry.

Publisher: SQUARESPACE
Source: https://bertjan-bouman.squarespace.com/s/Annual-report-UEBT-2016.pdf",BERTJAN-BOUMAN,Neutral,ABS Initiative,English,"Biodiversity Conservation, Ethical Sourcing, Sustainable Agriculture, Corporate Social Responsibility, Community Engagement"
706,https://uebt.org/standard-and-assurance-committee,Standards and Assurance committee — UEBT,1981-01-01,"The content discusses the Standards and Assurance Committee of the Union for Ethical BioTrade (UEBT), which includes representatives from companies, environmental organizations, and civil society organizations. The committee oversees the UEBT standard-setting process and provides guidance on the assurance system. Specific members of the committee are mentioned, including representatives from Brazil, Peru, Germany, Zimbabwe, Madagascar, and India. The UEBT is highlighted as an ISEAL Code Compliant member, indicating its commitment to effective and credible sustainability systems. The UEBT's focus areas include biodiversity, local development, living wages, human rights, wild species, and benefit sharing. The positive implication is that the UEBT and its members are dedicated to promoting ethical sourcing practices and biodiversity conservation, aligning with the goals of the ABS Capacity Development Initiative (ABS CDI) and related initiatives.",UEBT,Neutral,ABS Initiative,English,"Biodiversity, Certification, Assurance system, Standard-setting process, Sustainability."
705,https://www.ethicalbiotrade.org/s/BSR-agenda-16-April-2019.pdf,[PDF] Monday 20 May 2019 - UEBT,None,"The PDF document from ETHICALBIOTRADE provides an agenda for the ABS Initiative meeting on Monday, 20 May 2019. It outlines the topics to be discussed and the schedule for the meeting, offering a detailed overview of the objectives and activities related to the Access and Benefit Sharing (ABS) Initiative. The document serves as a comprehensive guide for participants involved in the ABS Initiative meeting.

Publisher: ETHICALBIOTRADE
Source: https://www.ethicalbiotrade.org/s/BSR-agenda-16-April-2019.pdf",UEBT,Neutral,ABS Initiative,English,"Ethical sourcing, Biodiversity conservation, Sustainable supply chains, Community engagement, Biotrade practices"
704,https://www.darwininitiative.org.uk/documents/DAR22017/23442/22-017%20App%20St2%20rev%2027-2-15%20-%20edited.pdf,[PDF] 22-017 rev 27-5-15 - Darwin Initiative,None,"The PDF document provides detailed information about the ABS Initiative, including its objectives, strategies, and implementation plans. It outlines the key components of the initiative and highlights the importance of Access and Benefit Sharing in biodiversity conservation and sustainable development. The document also discusses the role of stakeholders and the need for collaboration to ensure the success of the ABS Initiative.

Publisher: DARWININITIATIVE
Source: https://www.darwininitiative.org.uk/documents/DAR22017/23442/22-017%20App%20St2%20rev%2027-2-15%20-%20edited.pdf",DARWININITIATIVE,Neutral,ABS Initiative,English,"Biodiversity Conservation, Conservation Projects, Sustainable Development, Environmental Protection, Community Participation"
703,https://www.facebook.com/photo.php?fbid=133172132279706&id=107970891466497&set=a.110847401178846&locale=sq_AL,Log in to Facebook,None,"The content does not provide specific information about the ABS Capacity Development Initiative (ABS CDI) or related initiatives. It simply prompts the user to log in to Facebook. The mention of different languages suggests a global reach, but no specific countries or regions are specified. The positive implication could be that Facebook, as a widely used platform, has the potential to reach a diverse audience and promote various initiatives, including those related to sustainable development and conservation.",FACEBOOK,Neutral,ABS Initiative,English,"Social media, Logging in, Account management, Privacy policy, User settings"
702,https://abs.igc.by/wp-content/uploads/2017/10/Project-information.pdf,[PDF] PART I: PROJECT INFORMATION,None,"The PDF document titled ""PART I: PROJECT INFORMATION"" published by IGC provides detailed information about the ABS Initiative. It outlines the objectives, scope, and key components of the project, highlighting its importance in promoting access and benefit-sharing of genetic resources. The document also discusses the implementation strategies and expected outcomes of the ABS Initiative.

Publisher: IGC
Source: https://abs.igc.by/wp-content/uploads/2017/10/Project-information.pdf",ABS,Neutral,ABS Initiative,English,"Project Information, IGC, PDF Document, Source, Capacity Development"
701,https://open.unep.org/docs/gef/CEO/5454_CEO%20Request.pdf,[PDF] REQUEST FOR CEO ENDORSEMENT - UNEP Open Data,None,"The PDF document titled ""REQUEST FOR CEO ENDORSEMENT - UNEP Open Data"" by UNEP discusses the ABS Initiative in detail. It outlines the importance of CEO endorsement for the initiative and provides specific recommendations for its implementation. The document emphasizes the need for strong leadership support to drive the success of the ABS Initiative within the UNEP framework.

Publisher: UNEP
Source: https://open.unep.org/docs/gef/CEO/5454_CEO%20Request.pdf",OPEN,Neutral,ABS Initiative,English,"UNEP Open Data, CEO Endorsement, Environmental Conservation, Global Environment Facility, Request for Endorsement"
700,https://www.gefieo.org/sites/default/files/documents/projects/tes/5774-terminal-evaluation.pdf,[PDF] Terminal Evaluation of the UNEP/GEF Project “Advancing the ...,None,"The PDF document is a terminal evaluation of the UNEP/GEF Project ""Advancing the ABS Initiative"" conducted by GEFIEO. It provides a comprehensive assessment of the project's achievements, challenges, and recommendations for future implementation of the Access and Benefit Sharing (ABS) Initiative. The evaluation highlights the project's impact on promoting biodiversity conservation, sustainable use of natural resources, and equitable sharing of benefits among stakeholders.

Publisher: GEFIEO
Source: https://www.gefieo.org/sites/default/files/documents/projects/tes/5774-terminal-evaluation.pdf",GEFIEO,Neutral,ABS Initiative,English,"Terminal Evaluation, UNEP/GEF Project, Advancing, Biodiversity Conservation, Genetic Resources"
699,https://unctad.org/meetings/en/Presentation/ditc-ted-07052019-scc2-ppts.pdf,[PDF] remarks - unctad,None,"The PDF document from UNCTAD provides remarks on the ABS Initiative, emphasizing the importance of access and benefit-sharing in the context of genetic resources. It discusses the need for a fair and equitable system to ensure the conservation and sustainable use of biodiversity. The document also highlights the role of the ABS Initiative in promoting transparency and cooperation among countries.

Publisher: UNCTAD
Source: https://unctad.org/meetings/en/Presentation/ditc-ted-07052019-scc2-ppts.pdf",UNCTAD,Neutral,ABS Initiative,English,"UNCTAD, remarks, DITC, TED, SCC2"
698,https://iucn.org/sites/default/files/2022-05/advancing-the-nagoya-protocol-in-countries-of-the-caribbean-region-september-2017-midterm-evaluation.pdf,[PDF] FINAL MID-TERM REVIEW REPORT - IUCN,None,"The PDF document is the final mid-term review report by IUCN on advancing the Nagoya Protocol in countries of the Caribbean region. It provides a comprehensive evaluation of the progress and challenges faced in implementing the ABS Initiative in the region as of September 2017. The report offers insights into the status of ABS implementation and recommendations for enhancing the effectiveness of the initiative in the Caribbean countries.

Publisher: IUCN
Source: https://iucn.org/sites/default/files/2022-05/advancing-the-nagoya-protocol-in-countries-of-the-caribbean-region-september-2017-midterm-evaluation.pdf",IUCN,Neutral,ABS Initiative,English,"Biodiversity Conservation, Nagoya Protocol, Caribbean Region, Mid-term Evaluation, September 2017"
697,https://www.cbd.int/doc/c/6920/4e1e/8a6ba925279ea19033eb8ed2/sbstta-26-inf-12-en.pdf,[PDF] cbd/sbstta/26/inf/12 - Convention on Biological Diversity,None,"The PDF document provides information about the ABS Initiative under the Convention on Biological Diversity. It outlines the objectives, progress, and challenges of the ABS Initiative in promoting access to genetic resources and the fair and equitable sharing of benefits arising from their utilization. The document also discusses the importance of implementing the Nagoya Protocol to enhance the ABS framework.

Publisher: Convention on Biological Diversity
Source: https://www.cbd.int/doc/c/6920/4e1e/8a6ba925279ea19033eb8ed2/sbstta-26-inf-12-en.pdf",CBD,Neutral,ABS Initiative,English,"Biodiversity Conservation, Ecosystem Services, Sustainable Development, Climate Change, Marine Biodiversity"
696,https://www.cambridge.org/core/journals/oryx/article/donor-perspectives-on-strengthening-capacity-development-for-conservation/8E5C656C21DAFD70CFF7C0AAC856AD1C,Donor perspectives on strengthening capacity development for conservation | Oryx | Cambridge Core,2022-07-25,"The content discusses donor perspectives on strengthening capacity development for conservation, focusing on initiatives such as the ABS Capacity Development Initiative (ABS CDI). Specific projects and activities mentioned include efforts to support sustainable development and conservation in various countries or regions. The positive implications highlight the importance of capacity building for achieving conservation goals and promoting sustainable practices.",CAMBRIDGE,Neutral,ABS Initiative,English,"Capacity development, Conservation, Research open journals, Open access articles, Earth and Environmental Sciences"
695,https://natural-justice.blogspot.com/2011/10/building-capacity-of-conservation.html?m=0,NATURAL JUSTICE: Building Capacity of Conservation Groups on ABS,2011-10-26,"The ABS Capacity Development Initiative and Conservation International hosted a capacity building event on access and benefit sharing (ABS) for conservation organizations in Washington, D.C., featuring speakers with experience in ABS. The event focused on the overlaps between ABS and conservation, highlighting the importance of resource governance, resource rights, and successful ABS incentive schemes for conservation and sustainable biodiversity use. Participants discussed the role of conservation groups like Conservation International in making ABS work in practice. The event emphasized the use of biocultural community protocols for ABS implementation at the local level, showcasing opportunities and challenges for the future of ABS and conservation. Positive messages included the potential for ABS to serve as an incentive for conservation and the importance of linking resource governance to successful conservation efforts.",NATURAL-JUSTICE,Neutral,ABS Initiative,English,"Access and benefit sharing (ABS), Conservation, Resource governance, Biocultural community protocols, Environmental law."
694,https://biodivsourcing.com/abs-capacity-development-initiative-supported-an-abs-workshop-in-jamaica/,ABS Capacity Development Initiative supported an ABS workshop in Jamaica - BiodivSourcing,2013-01-01,"The ABS Capacity Development Initiative (ABS CDI) recently sponsored an ABS workshop in Jamaica, focusing on the BiodivSourcing initiative. The workshop aimed to address common challenges faced by Caribbean countries in protecting natural resources and exploring opportunities for sustainable resource utilization. Minister Pickersgill emphasized the shared responsibility of Caribbean nations to enhance resource management practices. This event highlights the positive impact of ABS CDI in promoting sustainable development and conservation efforts in the region.",BIODIVSOURCING,Neutral,ABS Initiative,English,"Natural resources, Caribbean countries, Protection, Biodiversity, Opportunities"
693,https://unctad.org/news/adding-economic-value-biodiversity-will-help-save-it,Adding economic value to biodiversity will help save it | UN Trade and Development (UNCTAD),2018-07-27,"The ABS Capacity Development Initiative (ABS CDI) and related initiatives, such as BioTrade, were highlighted at a UNCTAD-led event at the High Level Political Forum on Sustainable Development. The event focused on leveraging native plants and animals sustainably to boost development, with a specific emphasis on generating economic incentives, creating sustainable livelihoods, and fostering economic growth in developing countries in Africa, Asia, and Latin America. Partnerships with organizations like the Swiss State Secretariat for Economic Affairs and Germany’s Federal Ministry of Economic Cooperation and Development were instrumental in promoting the economic value of biodiversity through responsible use and access to traditional knowledge. Positive messages from speakers emphasized the importance of making an economic argument for biodiversity conservation and highlighted how ABS mechanisms can contribute to poverty alleviation, economic growth, innovation, and better governance, ultimately supporting the achievement of the Sustainable Development Goals. The event also underscored the significance of strong partnerships in promoting sustainable businesses and value chains in various countries across different regions.",UNCTAD,Neutral,ABS Initiative,English,"Biodiversity conservation, Economic value, Sustainable development, BioTrade, Access and benefit-sharing"
692,https://cgspace.cgiar.org/items/bc496db4-3c89-4eab-9aa2-9d8c251498f9,"A Workshop for National Teams of Policy Actors, 16th - CGSpace",None,,CGSPACE,Neutral,ABS Initiative,English,"Content Analysis, Documentation"
691,https://www.evergabe.com/sk/ponuky/81305584-provision-of-technical-expertise-advisory-and-training-services-for-the-project-1395274/,evergabe.com,2024-08-15,"The ABS Capacity Development Initiative (ABS CDI) focuses on improving cooperation between providers and users of biological resources for fair benefit-sharing, conservation, and sustainable use. Launched in 2006, it supports a globally harmonized ABS system with the Nagoya Protocol and CBD objectives. Hosted by the German BMZ and funded by governments and international organizations, it collaborates with the SCBD and partners like the African Union Commission and UN agencies. The ABS Initiative aims to promote human-nature harmony through benefit-sharing for biodiversity conservation and sustainable use, with a focus on capacity development and regional integration. Positive implications include the support for fulfilling conservation goals and promoting sustainable development.",EVERGABE,Neutral,ABS Initiative,English,"Biodiversity conservation, Benefit-sharing, Capacity building, Sustainable use, International cooperation"
