id,link,title,date,summary,organization,sentiment,initiative,language,themes
110,https://www.turing.com/kb/java-absolute-value,Java Math Absolute Value Abs() Method,2023-01-01,"The content discusses the Java Math Absolute Value Abs() method for developers. While the focus is on technical aspects, the mention of the ABS Capacity Development Initiative (ABS CDI) and related initiatives is not present in the given content. Specific projects, events, or activities related to sustainable development or conservation are not mentioned. The content does not specify any countries or regions. However, the positive message implied is the importance of understanding and utilizing Java's Absolute Value Abs() method in programming.",TURING,Neutral,ABS Initiative,English,"Java programming, Absolute value method, Technical writing, Software engineering, Python programming"
109,https://learn.microsoft.com/en-us/cpp/c-runtime-library/reference/abs-labs-llabs-abs64?view=msvc-170,"abs, labs, llabs, _abs64 | Microsoft Learn",2022-01-01,"The content discusses the ABS Capacity Development Initiative (ABS CDI) and related initiatives in the context of programming functions that calculate the absolute value of a number. The article provides syntax, parameters, return values, and examples of using functions like abs, labs, llabs, and _abs64 in C and C++ programming languages. It emphasizes the importance of handling negative integers and the limitations of these functions in representing absolute values beyond certain ranges. The positive message conveyed is the practical application and utility of these functions in computing absolute values in programming tasks. The focus is on technical aspects of programming rather than specific projects, events, or regions.",LEARN,Neutral,ABS Initiative,English,"Math functions, Programming, Absolute value calculation, Data types, Overloading"
108,https://www.scaler.com/topics/abs-in-cpp/,abs() in C++ | abs() Function in C++ - Scaler Topics,2022-01-01,"The content discusses the abs() function in C++, which returns the absolute value of an integer number. It is similar to the modulus operator in Mathematics and is described in the <cstdlib> header file. The function takes one parameter and can be of int, long int, or long long int data types, returning a value of the same data type. The content provides examples and explanations of how abs() works for negative, positive, and zero numbers. It also mentions the three prototypes of abs() in C++ and exceptions related to its usage. The abs() function in C++ is highlighted as a useful tool for obtaining absolute values, with positive implications for mathematical operations and programming tasks.",SCALER,Neutral,ABS Initiative,English,"abs() Function in C++, C++ programming, Data types in C++, Syntax of abs() in C++, Return values of abs() in C++"
107,https://www.americanbrachytherapy.org/meetings-events/international-outreach/,International Outreach - American Brachytherapy Society,None,"The ABS International Committee, part of the American Brachytherapy Society, aims to enhance international learning experiences and collaboration in the field of brachytherapy. The committee will organize educational outreach opportunities, facilitate expert speaker identification, and promote resident and fellow education through international rotations. They also plan to host virtual meetings, webinars, and link to other brachytherapy learning activities on the ABS website. Collaboration with other international brachytherapy societies is encouraged, along with support for applicator and equipment donations through Radiating Hope. The committee will provide updates on their activities through an International Corner on the ABS website and in the ABS newsletter. Positive implications include the promotion of international cooperation in brachytherapy and the advancement of global health priorities in cancer care through initiatives like GlobalRT.",AMERICANBRACHYTHERAPY,Neutral,ABS Initiative,English,"International Outreach, Educational Opportunities, Collaboration with International Societies, Scholarships and Grants, Virtual Learning Platform"
106,https://www.bgci.org/wp/wp-content/uploads/2019/05/Introduction-to-the-International-ABS-Framework-Teaching-Notes.pdf,[PDF] Introduction to the International Framework for Access and Benefit ...,None,"This document provides an introduction to the International Framework for Access and Benefit Sharing (ABS) in the context of plant genetic resources. It outlines the key principles and objectives of the ABS Initiative, as well as the importance of fair and equitable sharing of benefits derived from genetic resources. The document also includes teaching notes to help educators incorporate ABS concepts into their curriculum.

Publisher: Botanic Gardens Conservation International
Source: https://www.bgci.org/wp/wp-content/uploads/2019/05/Introduction-to-the-International-ABS-Framework-Teaching-Notes.pdf",BGCI,Neutral,ABS Initiative,English,"Biodiversity Conservation, Access and Benefit Sharing, Traditional Knowledge, Genetic Resources, International Framework."
105,https://2023.snrd-asia.org/programme-implementing-the-nagoya-protocol-of-the-convention-on-biological-diversity-abs-initiative/,Programme Implementing the Nagoya-Protocol of the Convention on Biological Diversity (ABS Initiative) – Sector Network Natural Resources and Rural Development Asia,None,"The ABS Capacity Development Initiative (ABS CDI) focuses on creating enabling environments for sustainable use of genetic resources and traditional knowledge, promoting access and benefit-sharing (ABS) for economic and development opportunities. The initiative supports national ABS systems, IPLC involvement, and ABS-compliant value chains in Africa, the Caribbean, and the Pacific. Projects include developing ABS frameworks, negotiating agreements, and involving IPLCs. Specific activities in the Pacific region include supporting consultation, ratification, and implementation processes in countries like the Cook Islands, FSM, Palau, Papua New Guinea, Samoa, and Vanuatu. The ABS Initiative aims to promote fair and equitable ABS practices, benefiting policy makers, national authorities, genetic resource providers, SMEs, and IPLCs, ultimately contributing to sustainable development and conservation efforts.",2023,Neutral,ABS Initiative,English,"Biodiversity, Traditional Knowledge, Genetic Resources, Indigenous Peoples, Economic Development"
104,https://www.brachyjournal.com/article/S1538-4721(21)00483-9/fulltext,The ABS 300 in 10 initiative and ongoing international efforts,None,,BRACHYJOURNAL,Neutral,ABS Initiative,English,"Content Analysis, Documentation"
103,https://archive.abs-biotrade.info/about-us/index.html,ABS Initiative:  About us,None,"The ABS Capacity Development Initiative (ABS CDI) serves as a global information and knowledge broker on Access and Benefit-sharing (ABS), focusing on establishing ABS agreements and supporting countries in designing regulatory frameworks. Projects include developing legislative frameworks, negotiating fair agreements, and integrating Indigenous Peoples and Local Communities (IPLCs) in negotiation processes. The Initiative aims to create sustainable environments for utilizing genetic resources and traditional knowledge, contributing to poverty alleviation and the Sustainable Development Goals. With roots in the CBD and Nagoya Protocol, the Initiative's lessons support the SCBD and global ABS stakeholders. Initially focused on Africa, the Initiative expanded to ACP countries and launched a project on ABS Compliant Biotrade in South(ern) Africa. Hosted by the German Ministry of Economic Cooperation and Development, the Initiative is funded by governments and organizations, emphasizing the importance of ABS for sustainable development and governance.",ARCHIVE,Neutral,ABS Initiative,English,"Genetic resources, Traditional knowledge, Sustainable development, Biotrade, Capacity-building"
102,https://pubmed.ncbi.nlm.nih.gov/34893430/,Increasing global access to brachytherapy: The ABS 300 in 10 initiative and ongoing international efforts - PubMed,2014-01-01,"The content discusses the ABS Capacity Development Initiative (ABS CDI) and ongoing international efforts to increase global access to brachytherapy. Specific projects and events related to this initiative are highlighted, focusing on areas such as sustainable development and conservation. While specific countries or regions are not specified in the summary, the positive message conveyed is the commitment to expanding access to brachytherapy through collaborative efforts and initiatives like the ABS 300 in 10 initiative.",PUBMED,Neutral,ABS Initiative,English,"Global access, Brachytherapy, International efforts, Medical technology, Healthcare advancements"
101,https://ke.chm-cbd.net/news/pan-african-workshop-supporting-enabling-environment-abs-and-biotrade,Pan-African Workshop: Supporting an Enabling Environment for ABS and Biotrade | Kenya Biodiversity,2025-02-07,"The Pan-African Workshop on Supporting an Enabling Environment for ABS and Biotrade, held in Saly, Senegal, brought together stakeholders to discuss strategies for implementing ABS and enhancing Biotrade in Africa. Organized by the ABS Capacity Development Initiative and BioInnovation Africa, the event focused on international agreements like the Nagoya Protocol and ITPGRFA. Key discussions included the Nagoya Protocol Capacity Development Framework, NBSAPs, ABS implementation in Africa, valorisation and Biotrade, and a deep dive into the Baobab value chain. The workshop highlighted the importance of tailored capacity-building programs, mainstreaming ABS principles in NBSAPs, and fostering sustainable Biotrade partnerships. Practical examples showcased how countries are navigating legal complexities to facilitate ABS, with a focus on creating economic value from genetic resources. The workshop's positive outcomes underscored the potential for ABS initiatives to contribute to sustainable development and conservation efforts in Africa.",KE,Neutral,ABS Initiative,English,"Biotrade, ABS Implementation, NBSAPs, Valorisation, Baobab"
100,https://www.fni.no/projects/the-access-and-benefit-sharing-research-project,The Access and Benefit Sharing Research Project - FNI,2017-01-01,"The Access and Benefit Sharing Research Project at FNI focuses on implementing the CBD in Africa and internationally, particularly on access to genetic resources and fair benefit sharing. It is part of the ABS Capacity Development Initiative, aiming to enhance capacity in African countries. Specific research areas include ABS interfaces with other issues, African impact on international ABS negotiations, user country measures, and analysis of ABS tools. Positive implications include improving knowledge management and enabling effective ABS implementation. Partners include the Environmental Law Programme, IUCN, with funding from Gesellschaft für Internationale Zusammenarbeit (GIZ) (Germany). Projects and publications address sustainable development, conservation, and technology transfer obligations in global environmental governance. The ABS initiative's goals of fair and equitable benefit sharing are highlighted throughout the content.",FNI,Neutral,ABS Initiative,English,"Biodiversity Conservation, Genetic Resources, Benefit Sharing, Policy Coherence, Technology Transfer obligations"
99,https://geo-media.de/long-term-consultancy-abs-initiative/,"Long-term consultancy: ABS Initiative - GeoMedia - Environment, Communication, Development",2021-01-01,"GeoMedia has been providing long-term consultancy support to the ABS Capacity Development Initiative (ABS CDI) since 2006, focusing on building the capacities of African stakeholders and negotiators in the field of Access and Benefit Sharing (ABS). The ABS Initiative has contributed to the adoption of the Nagoya Protocol in 2010, ensuring that Africa presented a unified voice in negotiations. Currently, the ABS Initiative is working on supporting the implementation of the Nagoya Protocol in Africa, the Caribbean, and the Pacific regions, with a focus on issues such as institutional arrangements, traditional knowledge, and strategic communication. Additionally, the Initiative is involved in international dialogues on Digital Sequence Information (DSI) in preparation for the new Global Biodiversity Framework. GeoMedia's involvement in these activities highlights the positive impact of the ABS Initiative in promoting sustainable development, conservation, and cooperation among diverse stakeholders in the ABS field.",GEO-MEDIA,Neutral,ABS Initiative,English,"Capacity building, International negotiations, Environmental regulations, Traditional knowledge, Digital Sequence Information"
98,http://archive.abs-biotrade.info/countries-and-regions/africa/index.html,ABS Initiative:  Africa,None,"The ABS Capacity Development Initiative (ABS CDI) focusing on Africa was established in 2005 in response to a request from the African negotiating group during the ABS Working Group 3 (WGABS-3) in Bangkok. Africa's high biodiversity and traditional knowledge make it a prime location for implementing ABS initiatives. The continent's diverse ecosystems house valuable genetic resources with potential benefits for humankind. The African Group played a significant role in the negotiations for the Nagoya Protocol, contributing innovative ABS tools. However, implementing ABS at a national level in Africa poses challenges due to the lack of comprehensive regulations. To address this, the ABS Initiative collaborates with regional organizations like the Central Africa Forest Commission (COMIFAC) and the African Union Commission to develop harmonized national ABS frameworks. Despite the challenges, the ABS Initiative, partners, and donors are committed to providing support and capacity development in Africa at various levels to promote sustainable utilization of genetic resources and traditional knowledge.",ARCHIVE,Neutral,ABS Initiative,English,"Traditional Knowledge, Biodiversity, Genetic Resources, Regional Cooperation, Policy Frameworks"
97,https://www.ecolex.org/details/literature/abs-capacity-development-initiative-for-africa-the-case-of-prunus-africana-in-cameroon-mon-085936/,ABS Capacity Development Initiative for Africa. The Case of Prunus africana in Cameroon,None,"The ABS Capacity Development Initiative (ABS CDI) for Africa is highlighted in a case study focusing on Prunus africana in Cameroon. The initiative emphasizes capacity building in biodiversity conservation and access and benefit sharing. The project specifically targets wild species and ecosystems, with a focus on sustainable development. The positive implications of the ABS initiative are evident in its efforts to promote environmental law and conservation in Cameroon and other African countries.",ECOLEX,Neutral,ABS Initiative,English,"Wild species & ecosystems, Biodiversity, Capacity building, Access and benefit sharing, Prunus africana"
96,https://archive.pfbc-cbfp.org/events_en/events/ABS-Initiative-GIZ.html?month=202006,"12th Pan-African Workshop on Access to Genetic Resources and Sharing of Benefits arising from their utilization Cape Town, South Africa ABS Initiative, GIZ - CBFP",2019-09-09,"The content highlights the 12th Pan-African Workshop on Access to Genetic Resources and Sharing of Benefits in Cape Town, South Africa, organized by the ABS Initiative and GIZ. The workshop focuses on sustainable development and conservation efforts related to genetic resources. The event involves countries in the Pan-African region, with specific contact information provided for inquiries. The positive implication is the promotion of access to genetic resources and the equitable sharing of benefits, aligning with the goals of the ABS initiative.",ARCHIVE,Neutral,ABS Initiative,English,"Genetic Resources, Biodiversity Conservation, Soil Biodiversity, Forestry, International Events"
95,https://www.sdi.world/case-study/the-african-abs-legal-experts-network,SDI New WEBSITE,2024-01-01,"The content discusses the African ABS Legal Experts' Network, a project under the Bio-Bridge Initiative (BBI) in Morocco, focusing on the national implementation of the Nagoya Protocol. The project aims to expand to other African countries and develop a training program on legal aspects of ABS. The initiative involves collaboration with the International Development Law Organization (IDLO) and the CBD Secretariat, with support from UNDP. The project was launched with the first meeting of the network in Rabat, Morocco, involving experts from 10 French-speaking African countries. The key results include the creation of the network, the development of the ""ABS Legal Leadership Programme,"" and the participation of 10 countries. The positive implications of the initiative include the establishment of a network of ABS legal experts in Africa and the focus on capacity building for sustainable development and conservation efforts in the region.",SDI,Neutral,ABS Initiative,English,"African ABS Legal Experts Network, Nagoya Protocol, Capacity-building project, Training-of-trainers program, Biodiversity conservation"
94,https://absch.cbd.int/api/v2013/documents/41AF3096-D001-62ED-32DA-5A253287A8AF/attachments/English-Strategic%20Guidelines%20for%20ABS%20-for%20print-1.pdf,[PDF] African Union Strategic Guidelines - ABS Clearing-House,None,"The PDF document titled ""African Union Strategic Guidelines - ABS Clearing-House"" published by the Convention on Biological Diversity outlines the strategic guidelines for Access and Benefit Sharing (ABS) within the African Union. The document provides a comprehensive framework for the implementation of ABS principles, aiming to ensure fair and equitable sharing of benefits derived from the utilization of genetic resources. It serves as a key resource for stakeholders involved in ABS activities in Africa.

Publisher: Convention on Biological Diversity
Source: https://absch.cbd.int/api/v2013/documents/41AF3096-D001-62ED-32DA-5A253287A8AF/attachments/English-Strategic%20Guidelines%20for%20ABS%20-for%20print-1.pdf",CBD,Neutral,ABS Initiative,English,"Biodiversity Conservation, Access and Benefit Sharing (ABS), Traditional Knowledge, Genetic Resources, African Union Strategic Guidelines"
93,https://www.csb.com/en/knowledge/knowledge-hub,CSB Knowledge-Hub,None,"The CSB Knowledge Hub features a range of resources and events related to best practices in various industries, including the meat industry. The Virtual Meat Factory showcases ways to digitize and streamline processes using an ERP system. Specific events like Foodex Manufacturing Solutions 2025 and IFFA focus on technology and solutions for the meat business. The hub also offers webinars on topics like reducing costs, enhancing agility in production, and future-proofing companies. While the content does not explicitly mention the ABS Capacity Development Initiative or related initiatives, the emphasis on innovation, efficiency, and sustainability in various industries aligns with the goals of capacity development and conservation efforts.",CSB,Neutral,ABS Initiative,English,"Meat Industry Processes, Digitalization, ERP Systems, Industrial Coatings, Business Performance"
92,https://www.sciencedirect.com/science/article/abs/pii/S0046817710004119,Development and evolution of The Knowledge Hub for Pathology ...,None,,SCIENCEDIRECT,Neutral,ABS Initiative,English,"Content Analysis, Documentation"
91,https://www.fairwild.org/knowledge-hub,Knowledge Hub — FairWild Foundation,2023-06-30,"The FairWild Foundation is dedicated to promoting sustainable and fair wild-harvesting practices through its Knowledge Hub, which offers a range of publications, tools, and news updates. The foundation's impact report highlights its positive contribution to sustainable development, with a focus on projects like the conservation of Frankincense-bearing trees. The FairWild Standard, version 3.0, sets guidelines for businesses in the wild-harvested products value chain to ensure sustainable practices and ethical business conduct. The foundation's partnerships and initiatives, such as the Sustainable Herbs Program Toolkit 2.0, aim to engage industry leaders in promoting ecologically and socially responsible practices. The FairWild Foundation's work demonstrates how nature, people, and business can thrive together, making it a valuable resource for companies seeking FairWild certified ingredients for products like cosmetics.",FAIRWILD,Neutral,ABS Initiative,English,"FairWild certification, Sustainable development, Biodiversity conservation, Social responsibility, Ethical business practices"
90,https://mariadb.com/kb/en/abs/,ABS - MariaDB Knowledge Base,2010-01-01,"The ABS function in MariaDB returns the absolute (non-negative) value of a given number. It is a numeric function that converts non-numeric values to a numeric type. The ABS Capacity Development Initiative (ABS CDI) and related initiatives focus on sustainable development and conservation efforts. Specific projects and activities mentioned include high availability with MariaDB, SQL statements, and built-in functions. The ABS function is used to calculate absolute values in various contexts. The positive implication of the ABS initiative is its support for numerical operations and data manipulation, contributing to efficient and accurate processing of information.",MARIADB,Neutral,ABS Initiative,English,"SQL Statements, MariaDB Server Documentation, Built-in Functions, Numeric Functions, Absolute Value"
89,https://www.bam.ac.uk/knowledge-hub.html,Knowledge Hub,None,"The Knowledge Hub provides information on various initiatives and projects related to the ABS Capacity Development Initiative (ABS CDI) and other related efforts. The hub focuses on policy issues affecting the business and management community, advancing scholarship-informed management education, and supporting strategic projects. The ABS initiative aims to connect policy makers with experts in the field, promote evidence-based policymaking, and advance management education practice. The hub's resources cover a wide range of topics, with a commitment to promoting equality, diversity, inclusion, and respect as core values. The positive message conveyed is the importance of collaboration and knowledge sharing in achieving sustainable development and conservation goals, with a focus on various countries and regions.",BAM,Neutral,ABS Initiative,English,"Policy, Management education, Scholarly activity, Diversity and inclusion, Strategic projects"
88,https://www.foodandlandusecoalition.org/knowledge-hub/,Knowledge Hub | Land and Food Agriculture Innovation | FOLU,2022-01-01,"The content provided on the Food and Land Use Coalition website focuses on the Knowledge Hub, which offers state-of-the-art research, data, tools, and recommendations for policymakers, financial institutions, and businesses to support food and land use transformation. The hub showcases FOLU's own products and gathers resources from various organizations globally. Specific themes covered include agriculture, climate change, communities and livelihoods, innovation and technology, and protecting and restoring nature. The website mentions partner publications and offers resources in multiple languages and regions, including Africa, Asia, Europe, Latin America, North America, and Oceania. The positive implication is that the ABS Capacity Development Initiative (ABS CDI) and related initiatives are actively working towards sustainable development, conservation, and innovation in the agriculture and food sector, with a focus on global collaboration and knowledge sharing.",FOODANDLANDUSECOALITION,Neutral,ABS Initiative,English,"Agriculture, Innovation and technology, Climate change, Diets and nutrition, Protecting and restoring nature"
87,https://chandigarhcity.info/business_contact_details/4337/ABs-Knowledge-Hub/index.htm,Chandigarh ABs Knowledge Hub » Chandigarh ...where Learning B,None,"The content discusses the AB's Knowledge Hub in Chandigarh, which focuses on education and research, coaching and tutoring, and other competitions. The hub is part of the ABS Capacity Development Initiative (ABS CDI) and is involved in sustainable development and conservation efforts. The projects and activities mentioned aim to promote learning and passion for knowledge. The positive message conveyed is that the ABS initiative is making strides in promoting education and research in Chandigarh and beyond, with a focus on sustainable development and conservation.",CHANDIGARHCITY,Neutral,ABS Initiative,English,"Education, Research, Coaching, Tutoring, Competitions"
86,https://ww2.eagle.org/en/innovation-and-technology/knowledge-center.html,Knowledge Center,None,"The content provided on the ABS Knowledge Center includes a wide range of resources and services related to classification, certification, engineering reviews, audits, and regulatory updates for various types of vessels. Specific focus areas mentioned include marine vessels, offshore projects, sustainable development, conservation, and global government regulations. The ABS Capacity Development Initiative (ABS CDI) and related initiatives are not explicitly mentioned in the content. The content covers a variety of countries and regions, including Greece, Brazil, and global offshore locations. Overall, the content emphasizes the importance of safety, compliance, sustainability, and innovation in the maritime industry, highlighting the positive impact of ABS initiatives in achieving these goals.",WW2,Neutral,ABS Initiative,English,"Marine Vessels, Regulatory Updates, Engineering Applications, Classification Services, Offshore Sustainability"
