id,link,title,date,summary,organization,sentiment,initiative,language,themes
606,https://www.abs.gov.au/how-cite-abs-sources,How to cite ABS sources | Australian Bureau of Statistics,2020-12-11,"The content provides a guide on how to cite ABS sources, with specific formatting guidelines for different types of resources such as general web pages, time series spreadsheets, data cubes, census material, maps, tables, and figures. The ABS Capacity Development Initiative (ABS CDI) and related initiatives are not explicitly mentioned in the content. The focus is on providing clear instructions for referencing ABS sources, with examples given for each type of resource. The content does not specify any particular projects, events, or activities related to sustainable development or conservation. The countries or regions mentioned are Australia and are not the main focus of the content. The positive message conveyed is the importance of accurately citing ABS sources, highlighting the continuous updating and changing nature of ABS content. This emphasizes the credibility and reliability of the ABS initiative and its commitment to providing accurate statistical information.",ABS,Neutral,ABS Initiative,English,"Citing guidelines, ABS sources, Webpage formatting, Time series spreadsheets, Data cubes"
605,https://www.iisd.org/publications/abs-management-tool-best-practice-standard-and-handbook-implementing-genetic-resource,ABS-Management Tool: Best Practice Standard and Handbook for Implementing Genetic Resource Access and Benefit-sharing Activities | International Institute for Sustainable Development,2007-09-27,"The ABS-Management Tool (ABS-MT) is a best practice standard and handbook aimed at providing guidance on Access and Benefit-sharing (ABS) activities related to genetic resources. It helps companies, researchers, communities, and governments comply with ABS requirements under the Convention on Biological Diversity. The tool offers structured processes for ABS negotiations and agreements. The publication includes two volumes: Volume 1 covers an overview of ABS and the Best Practice Standard, while Volume 2 offers Good Practice Guidance, Supporting Tools, and case studies. The ABS initiative promotes sustainable development, conservation, and equitable sharing of benefits. Positive implications include increased compliance with ABS regulations and improved decision-making in ABS negotiations, benefiting users and providers of genetic resources. The initiative supports global efforts to enhance biodiversity conservation and sustainable resource management.",IISD,Neutral,ABS Initiative,English,"Genetic Resource Access, Benefit-sharing Activities, Bonn Guidelines, Management Processes, Case Studies"
604,https://absa.org/topic/ttr/,Training Tools & Resources - ABSA International,None,,ABSA,Neutral,ABS Initiative,English,"Content Analysis, Documentation"
603,https://www.undp.org/publications/access-genetic-resources-and-benefit-sharing-theory-practice-under-nagoya-protocol,Access to Genetic Resources and Benefit Sharing: Theory to Practice under the Nagoya Protocol | United Nations Development Programme,2021-07-22,"The content discusses the Access to Genetic Resources and Benefit Sharing (ABS) initiative under the Nagoya Protocol, building on the ABS Capacity Development Initiative (ABS CDI) and related efforts. It highlights specific projects and activities in 24 countries worldwide, focusing on sustainable development, conservation, and promoting benefits for local communities. The report emphasizes policy options to facilitate access to genetic resources and the flow of benefits, showcasing the Global ABS Community's South-South cooperation. The document celebrates biological, genetic, and cultural diversity, showcasing indigenous peoples, local communities, scientists, and policymakers globally. Overall, the publication conveys a positive message about the ABS initiative's goals, emphasizing the potential for genetic resources to improve livelihoods, increase incomes, enhance food security, and contribute to biodiversity conservation.",UNDP,Neutral,ABS Initiative,English,"Genetic Resources, Benefit Sharing, Biodiversity Conservation, South-South Cooperation, Indigenous Peoples"
602,https://www.uni-bremen.de/feu/forschung/projekte/abs/abs-access-to-genetic-resources-and-benefit-sharing,ABS: Access to Genetic Resources and Benefit Sharing - Universität Bremen,2017-04-19,"The ABS Capacity Development Initiative (ABS CDI) and related initiatives aim to regulate access to genetic resources and ensure fair and equitable benefit sharing. The Convention on Biological Diversity (CBD) of 1992 plays a key role in this process, with a focus on conservation, sustainable use, and benefit sharing of genetic resources. The ABS initiative seeks to create incentives for countries and communities to conserve biodiversity by sharing benefits from the use of genetic resources. Countries have sovereign rights over their natural resources and can regulate access to genetic resources based on prior informed consent. This initiative has positive implications for conservation efforts and sustainable development, highlighting the importance of equitable sharing of benefits for all parties involved.",UNI-BREMEN,Neutral,ABS Initiative,English,"Biodiversity Conservation, Genetic Resources, Benefit Sharing, Sovereign Rights, Prior Informed Consent"
601,http://absexcelresources.com/,ABS Excel Resources PLT,None,"ABS Excel Resources PLT is a group of engineers specializing in engineering consultation and energy management, offering training programs in various fields such as mechanical, energy management, fire protection systems, and electrical maintenance. They provide courses such as Kursus Kad Hijau and Kursus Pengendalian Makanan, focusing on sustainable practices and safety in construction. The company's portfolio showcases their work in power quality assessment, energy management, thermal imaging, and fire protection systems. ABS Excel Resources PLT is a certified HRDF training provider and offers courses under the SBL Scheme and SBL-Khas Scheme. They are also a registered provider for Kursus Kad Hijau CIDB and SLPM registered with KKM. The positive message conveyed is their commitment to providing quality training and services in line with industry standards and regulations.",ABSEXCELRESOURCES,Neutral,ABS Initiative,English,"Engineering Consultation, Energy Management, Fire Protection Systems, Electrical Maintenance, Training Programs"
600,https://www.abs125.com/,"Flexible Spending Account Administrators (FSA plans) | ABS, Inc.",2011-01-01,"ABS, Inc. is a leading provider of Flexible Spending Account administration services since 1993, offering a range of employee benefit programs including Health Savings Accounts, Health Reimbursement Arrangements, and Transportation Benefits. The company also provides educational tools and resources for employers and plan participants. The testimonials from satisfied clients highlight the excellent customer service and personalized attention provided by ABS employees. The positive feedback reflects the company's commitment to meeting the healthcare needs of its clients. The content does not specifically mention the ABS Capacity Development Initiative (ABS CDI) or related initiatives, specific projects, events, or activities related to sustainable development or conservation, or any particular countries or regions. However, the emphasis on customer service and personalized care in the testimonials suggests a positive message about the goals of the ABS initiative in providing quality benefits and support to its clients.",ABS125,Neutral,ABS Initiative,English,"Flexible Spending Account Management, Health Savings Account Management, Health Reimbursement Arrangement, Transportation Benefits, Tuition Reimbursement"
599,https://www.naturvardsverket.se/en/guidance/species-protection/utilizing-genetic-resources/,"Genetic resources, Nagoya Protocol",2014-10-12,"The content discusses the Nagoya Protocol and the EU ABS Regulation, which aim to regulate the use of genetic resources and ensure fair benefit-sharing for countries where these resources are collected. The ABS Capacity Development Initiative (ABS CDI) is not explicitly mentioned, but the guidance provided is in line with the goals of capacity development in the context of access and benefit-sharing. Specific projects or events are not mentioned, but the focus areas include conservation, sustainable development, and fair benefit-sharing. The content is relevant for those conducting research or product development using genetic resources and traditional knowledge, as well as funding agencies, universities, authorities, and companies in various industries. The positive message conveyed is that the regulatory framework supports the conservation and sustainable use of biodiversity while ensuring fair benefit-sharing for countries providing genetic resources.",NATURVARDSVERKET,Neutral,ABS Initiative,English,"Genetic resources, Nagoya Protocol, EU ABS Regulation, Biodiversity conservation, Traditional knowledge"
598,https://absbio.com/abs-blog/too-few-resources/,Too Few Resources - ABS Bio,None,,ABSBIO,Neutral,ABS Initiative,English,"Content Analysis, Documentation"
597,https://www.absfasteners.com/resources.html,ABS Fasteners - Resources,None,"The content provided includes information about ABS Fasteners, a company with locations in various states and now in Baja, Mexico. The website offers resources and downloads such as catalogs, reference guides, and flyers. While the content does not specifically mention the ABS Capacity Development Initiative (ABS CDI) or related initiatives, it showcases the company's commitment to serving various industries with quality fasteners and hardware. The positive implication is that ABS is dedicated to providing resources and support to its customers, potentially contributing to their success in their projects and endeavors.",ABSFASTENERS,Neutral,ABS Initiative,English,"Locations, Industry coverage, New website launch, Resources and downloads, Fasteners and hardware catalog"
596,https://www.census.gov/abs,Annual Business Survey (ABS) Program,2024-01-01,"The Annual Business Survey (ABS) Program, managed by the U.S. Census Bureau, collects data on business ownership through surveys and administrative records. The ABS Program focuses on employer businesses and nonemployer data, providing detailed information and statistics on various business sectors. Recent events and activities highlighted by the ABS Program include the release of data on minority-owned, veteran-owned, and women-owned businesses, as well as the celebration of Manufacturing Day. These initiatives showcase the ABS Program's commitment to highlighting diverse business ownership and contributions to the economy. The ABS CDI and related initiatives aim to support sustainable development and conservation efforts, with a focus on countries and regions that benefit from capacity development programs. The positive messages and implications of these initiatives underscore the importance of data-driven decision-making and support for diverse businesses in achieving their goals.",CENSUS,Neutral,ABS Initiative,English,"Annual Business Survey, Data collection, Business ownership, Minority-owned businesses, Women-owned businesses"
595,https://www.abs-tpa.com/,Home - Automated Benefit Services,2019-01-01,"The content discusses the services provided by Automated Benefit Services (ABS) in simplifying benefits management for members, providers, and employers. ABS aims to create a healthcare experience that is easy, efficient, and customer-centric by providing guidance on benefits and access to resources. The ABS Capacity Development Initiative (ABS CDI) and related initiatives are not specifically mentioned in the content. The focus areas of ABS include claims processing, billing accuracy, and administering benefits for members. The positive message conveyed is that ABS has a long history of exceptional customer service and aims to create clarity and efficiency in healthcare management. The content does not specify any countries or regions where ABS operates.",ABS-TPA,Neutral,ABS Initiative,English,"Benefits Management, Provider Services, Employer Benefits, Healthcare Experience, Resource Information"
594,https://www.absbehavioralhealthservices.com/aba-individualized-vocational-services-resources,Resources - ABA & Individualized Vocational Services in MA,2021-01-01,"The content provided lists various resources related to autism and behavior analysis, including organizations like Autism Speaks and the Association for Behavior Analysis. Specific projects and activities mentioned include the Autism Resource Center of Central Massachusetts and Creating Visual Supports. The focus areas of these resources range from autism advocacy to vocational services. While the content does not explicitly mention the ABS Capacity Development Initiative or related initiatives, the positive implication is that there are a variety of resources available to support individuals with autism and promote their well-being and development. The content covers a range of countries and regions, with a focus on Massachusetts in the United States.",ABSBEHAVIORALHEALTHSERVICES,Neutral,ABS Initiative,English,"ABA services, Individualized Vocational Services, Autism resources, Speech and Language Specialities, Support and Advocacy"
593,https://environment.ec.europa.eu/topics/nature-and-biodiversity/sharing-natures-genetic-resources_en,Sharing nature’s genetic resources - European Commission,2025-01-01,"The European Commission emphasizes the importance of sharing nature's genetic resources in a fair and equitable manner with the countries providing these resources. The ABS Capacity Development Initiative (ABS CDI) and related initiatives aim to ensure that benefits from genetic resources are shared appropriately, in line with international agreements such as the Nagoya Protocol. Specific projects and activities focus on implementing regulations, establishing clear frameworks for access and benefit sharing, and monitoring user compliance. These efforts demonstrate a commitment to sustainable development, conservation, and respecting the sovereign rights of countries over their genetic resources. Positive messages about the ABS initiative include promoting fairness, transparency, and responsible use of genetic resources for the benefit of all parties involved.",ENVIRONMENT,Neutral,ABS Initiative,English,"Genetic Resources, Access and Benefit Sharing, Nagoya Protocol, EU ABS Regulation, Traditional Knowledge"
592,https://cbrain.com/access-benefit-sharing-of-genetic-resources-abs-solution,cBrain - Access Benefit Sharing,2025-01-01,"The Danish Environmental Protection Agency has successfully enhanced compliance monitoring under the Nagoya Protocol by implementing a fully digital inspection system, facilitated by cBrain's F2 solution. This initiative aims to ensure fair and equitable sharing of benefits from genetic resources utilization, in line with the EU Access and Benefit Sharing (ABS) regulations. By automating due diligence inspections and streamlining oversight processes, the Danish EPA can effectively monitor organizations accessing genetic resources, promoting transparency and legal certainty. This digital solution not only improves regulatory enforcement but also contributes to global biodiversity conservation and sustainable development goals. The positive implications of this initiative highlight the importance of efficient systems in supporting ABS compliance efforts and fostering international cooperation in benefit-sharing.",CBRAIN,Neutral,ABS Initiative,English,"Genetic Resources, Compliance Monitoring, Benefit Sharing, Biodiversity Conservation, Sustainable Development"
591,https://www.sifma.org/resources/research/statistics/us-asset-backed-securities-statistics/,US Asset Backed Securities Statistics - SIFMA - US Asset Backed Securities Statistics - SIFMA,2025-03-05,"SIFMA Research provides detailed statistics on the U.S. asset-backed securities market, covering issuance, trading, and outstanding data across various sub-categories within the ABS sector. The data includes trends analysis and is available for download on a daily, monthly, quarterly, and annual basis. As of February, YTD statistics show positive growth in issuance (+7.7% Y/Y) and a decrease in trading volume (-13.4% Y/Y). The ABS Capacity Development Initiative (ABS CDI) aims to support sustainable development and conservation efforts in the sector, with a focus on countries and regions where ABS initiatives are crucial. The positive implications of these initiatives are reflected in the growth of the ABS market and the commitment to regulatory compliance and market integrity.",SIFMA,Neutral,ABS Initiative,English,"Statistics, Asset-backed securities, Fixed income market structure, Securitization, Trading volumes"
590,https://www.bloomberg.com/profile/company/4922416Z:US,Abs Support Services Inc - Company Profile and News,None,,BLOOMBERG,Neutral,ABS Initiative,English,"Content Analysis, Documentation"
589,https://www.pbtech.com/product/INKBAM0005/Bambu-Lab-Filament-Support-for-ABS-White-66100-175,"Bambu Lab Filament Support for ABS White 66100 1.75mm, 0.5kg ...",None,,PBTECH,Neutral,ABS Initiative,English,"Content Analysis, Documentation"
588,https://www.youtube.com/watch?v=KnvEhYCimKc,- YouTube,2024-03-06,"The content does not provide information related to the ABS Capacity Development Initiative (ABS CDI) or any specific projects, events, or activities focusing on sustainable development or conservation. It also does not mention any specific countries or regions. As a result, no positive messages or implications about the ABS initiative or its goals can be inferred from the content provided.",YOUTUBE,Neutral,ABS Initiative,English,"Technology, Online video platform, Copyright, Advertising, Privacy"
587,https://remote.abshelp.com/,ABS Global Support Center,None,"The ABS Global Support Center offers remote technical support services through the ABSHelp system. Users are reminded to maintain the confidentiality of their login information and account activities. By agreeing to the terms, users indemnify ABSHelp's agents and representatives from any claims arising from the remote support session. The ABS Capacity Development Initiative (ABS CDI) and related initiatives aim to support sustainable development and conservation efforts globally. The positive message conveyed is the commitment to providing technical support for the benefit of users and the ABS initiative's goals.",REMOTE,Neutral,ABS Initiative,English,"Global Support Center, Remote technical support services, Confidentiality, Indemnification, Remote support session."
586,https://www.raise3d.com/filaments/abs/,ABS - Reliable and versatile rigid filament,None,"The content focuses on ABS (Acrylonitrile butadiene styrene) filament, highlighting its reliability, stiffness, strength, and impact resistance in 3D printing. ABS is known for its dimensional stability and chemical resistance, making it ideal for various applications such as engineering, prototyping, and part assembling. The content also mentions specific 3D printing projects and products, including the Pro3 HS Series and DF2 (DLP Resin), catering to industries like engineering, manufacturing, automotive, aerospace, schools, medical, and entertainment. The positive message conveyed is the versatility and reliability of ABS filament for a wide range of applications, emphasizing its importance in sustainable development and innovation.",RAISE3D,Neutral,ABS Initiative,English,"3D Printing, Filaments, Resins, Industries, Applications"
585,https://support.microsoft.com/en-us/office/abs-function-ecd891be-d7b3-4bb4-9b59-f72db589cc0d,ABS function - Microsoft Support,2014-01-01,"The content provided discusses the ABS function in Microsoft Support, specifically focusing on the syntax and example of using the ABS function to return the absolute value of a number without its sign. While the content does not directly reference the ABS Capacity Development Initiative (ABS CDI) or related initiatives, it does highlight the importance of understanding and utilizing ABS functions in various Microsoft products. The content does not mention specific projects, events, or activities related to sustainable development or conservation. The information is applicable to users of SharePoint Server, SharePoint in Microsoft 365, and other Microsoft products. Overall, the content emphasizes the practical use and benefits of the ABS function in Microsoft Support for users seeking assistance with numerical calculations.",SUPPORT,Neutral,ABS Initiative,English,"Microsoft Support, ABS function, SharePoint Server, Microsoft 365, Absolute value"
584,https://ww2.eagle.org/en.html,American Bureau of Shipping (ABS) Eagle.org,None,"The American Bureau of Shipping (ABS) website provides a wide range of services related to classification, certification, engineering reviews, and audits for various types of vessels. The ABS Capacity Development Initiative (ABS CDI) is mentioned in the context of regulatory updates, engineering applications, and classification services. Specific projects and activities focus on marine sustainability, offshore wind projects, offshore production, and global government rules and guides for naval ships. The ABS initiative has positive implications for sustainable development, conservation, and global trade compliance, highlighting the organization's commitment to promoting safety, efficiency, and environmental responsibility in the maritime industry.",WW2,Neutral,ABS Initiative,English,"Marine Vessels, Offshore, Regulatory Updates, Engineering Applications, Classification Services"
583,https://abslbs.com/support-release/,Support Release – ABS Laundry Business Solutions,None,"The content discusses the support release of ABS Laundry Business Solutions, highlighting the continuous investment in new features and functionality to keep installations up-to-date and ready for the future. ABS releases a new core release annually, supported for at least two years, with additional support for blocker issues for another year. The current latest supported release is v9.00.00.d. The focus is on planned logistics, tracking & tracing, stockroom management, product delivery, route accounting, invoicing, and various services like linen supply, garment services, and facility services. ABS emphasizes sustainability and offers software development, training, and consultancy services to help customers grow. The positive message is the commitment to ongoing support and development to ensure customer satisfaction and long-term success. The ABS Capacity Development Initiative (ABS CDI) and related initiatives are not explicitly mentioned in the content. The specific countries or regions are also not specified.",ABSLBS,Neutral,ABS Initiative,English,"Customer Portals, Software Development, Support Desk, Training, Sustainability"
582,https://www.tiktok.com/@dddprinter/video/7322178220441341216,TikTok,2020-06-29,"The content does not mention the ABS Capacity Development Initiative (ABS CDI) or related initiatives. It focuses on the decision of the Government of India to block 59 apps, including TikTok, on June 29, 2020. The message from TikTok India Team emphasizes their commitment to complying with the government's directive, understanding the issue, and prioritizing the privacy and security of users in India. The content does not specify any specific projects, events, or activities related to sustainable development or conservation. The message is directed towards users in India and does not mention any specific countries or regions. Overall, the message conveys a positive tone in terms of TikTok's willingness to work with the government and prioritize user privacy and security.",TIKTOK,Neutral,ABS Initiative,English,"TikTok, Government of India, Blocking of apps, Privacy and security, User compliance"
581,https://shop.3dherndon.com/bambu-lab-support-for-abs?srsltid=AfmBOorkJEf-o5f5czDjRGSgKh-2J-toMbw5e7OV51HNHvwTH7tkroPT,Bambu Lab Support for ABS > Bambu Lab,None,"Bambu Lab offers innovative support material for ABS printing, enhancing the printing experience with easy removal and superior quality. The material is fully compatible with AMS systems, streamlining the printing process. The support material ensures a flawless interface and efficient workflow, with RFID technology for intelligent printing. The focus is on improving the ABS printing experience, with a specific emphasis on support removal and interface quality. The positive message is about simplifying the printing process and achieving better results, contributing to the goals of the ABS Capacity Development Initiative and related initiatives.",SHOP,Neutral,ABS Initiative,English,"Support Material, ABS Printing, Filament, AMS Systems, RFID Technology"
580,https://www.youtube.com/watch?v=rFNT3nOtHsU,- YouTube,2024-03-06,"The content does not provide any information related to the ABS Capacity Development Initiative (ABS CDI) or any other specific projects, events, or activities. It also does not mention any countries or regions specified in relation to sustainable development, conservation, or other related areas. The content simply includes general information about YouTube, such as how it works, copyright information, and contact details. As a result, there are no positive messages or implications about the ABS initiative or its goals in the given content.",YOUTUBE,Neutral,ABS Initiative,English,"Technology, Online video platform, Copyright, Advertising, Privacy"
